{"schema":"ev4-builder-personal-state-capsule@1.0.0","session_id":"BSESSION-001","source_file_sha256":"aaaaaaaaaaaaaaaaaaaaaaaaaaaaaaaaaaaaaaaaaaaaaaaaaaaaaaaaaaaaaaaa","canonical_package_digest":"bbbbbbbbbbbbbbbbbbbbbbbbbbbbbbbbbbbbbbbbbbbbbbbbbbbbbbbbbbbbbbbb","selected_candidate_id":"CANDIDATE-001","intake_capsule_sha256":"cccccccccccccccccccccccccccccccccccccccccccccccccccccccccccccccc","session_state_sha256":"dddddddddddddddddddddddddddddddddddddddddddddddddddddddddddddddd","checkpoint_sha256":"eeeeeeeeeeeeeeeeeeeeeeeeeeeeeeeeeeeeeeeeeeeeeeeeeeeeeeeeeeeeeeee","workflow_mode":"APPROVED_HANDOFF_MODE","runtime_state":"BUILD_ACTIVE","previous_resumable_state":null,"unresolved_blocking_evidence":[],"parent_state_capsule_sha256":null,"source_input_path_hint":"builder-input.json","checkpoint_id":"CP-001","event":"intake_authorized"}
